{
  "schema_version": 1,
  "run_id": "dry-contiguous-saturation",
  "telemetry_schema": "schemas/telemetry_frame.schema.json",
  "frame_counter_mode": "contiguous",
  "timestamp_origin": "absolute",
  "metadata": {
    "source": "committed dry-run boundary fixture",
    "physical_output": false
  },
  "checks": [
    {
      "id": "saturated-contiguous-integrity",
      "type": "sequence",
      "max_sample_gap_ms": 200
    }
  ]
}
