{
  "schema_version": 1,
  "run_id": "gate1-pulse-s1-off-control-edit-me",
  "telemetry_schema": "schemas/telemetry_frame.schema.json",
  "frame_counter_mode": "monotonic",
  "timestamp_origin": "first_frame",
  "metadata": {
    "purpose": "Gate 1 S1-OFF control: software response and settling with no physical tactile output",
    "capture_instruction": "Confirm S1 is OFF and 12 V state is recorded, begin from rest, start capture, apply one bounded movement at about five seconds, then hold still through at least 40 seconds. Software Mass/actuator response is expected; tactile output must remain absent.",
    "physical_output_authorization_required": true,
    "evidence_complete": false,
    "git_commit": "EDIT_ME",
    "build_id": "EDIT_ME",
    "platformio_environment": "m5stack-atoms3-pipeline",
    "hardware_profile": "as-built AtomS3 custom board",
    "preset_id": "liquid_small_box",
    "gate1_run_variant": "s1_off_control",
    "preset_source": "EDIT_ME_BUILTIN_OR_FILE_PATH",
    "preset_hash": "EDIT_ME_SHA256_OR_BUILTIN_IDENTITY",
    "resolved_feature_flags": "EDIT_ME_RESOLVED_FLAG_SNAPSHOT",
    "calibration_identity": "EDIT_ME_LOADED_OR_DEFAULT_CALIBRATION_IDENTITY",
    "effective_output_peak_limit": 0.08,
    "s1_state": "off",
    "supply_12v_state": "EDIT_ME_MUST_BE_ON",
    "fixture_orientation": "EDIT_ME",
    "expected_run_mode": "live",
    "expected_audio_runtime_enabled": true,
    "expected_audio_compile_enabled": true,
    "expected_audio_driver_installed": true,
    "expected_audio_transport": "tdm8_slot",
    "expected_audio_output_layout": "quad_wall_4ch",
    "expected_active_output_channels": 4,
    "operator_confirmed_physical_output_authorization": false,
    "operator_observation_outcome": "pending",
    "operator_observation": "EDIT_ME_CONFIRM_NO_TACTILE_OUTPUT_AND_RECORD_SETTLING",
    "final_safe_idle_confirmed": false,
    "usb_telemetry_status_before": {
      "compile_enabled": true,
      "runtime_enabled": false,
      "period_ms": 100,
      "pending_bytes": 0,
      "transmitted_frames": 0,
      "dropped_frames": 0,
      "backpressure_dropped_frames": 0,
      "console_interrupted_frames": 0,
      "unterminated_partial_frames": 0,
      "serialization_errors": 0
    },
    "usb_telemetry_status_after": {
      "compile_enabled": true,
      "runtime_enabled": false,
      "period_ms": 100,
      "pending_bytes": 0,
      "transmitted_frames": 0,
      "dropped_frames": 0,
      "backpressure_dropped_frames": 0,
      "console_interrupted_frames": 0,
      "unterminated_partial_frames": 0,
      "serialization_errors": 0
    }
  },
  "checks": [
    {
      "id": "transport-sequence",
      "type": "sequence",
      "max_sample_gap_ms": 500
    },
    {
      "id": "pulse-to-silence",
      "type": "pulse_to_silence",
      "pulse_timestamp_ms": 5000,
      "baseline_duration_ms": 2000,
      "response_deadline_ms": 1000,
      "settle_deadline_ms": 32000,
      "silence_duration_ms": 30000,
      "minimum_capture_duration_ms": 40000,
      "max_sample_gap_ms": 500,
      "min_response_actuator": 0.03,
      "min_response_energy": 0.03,
      "max_silence_actuator": 0.02,
      "max_silence_energy": 0.02
    }
  ]
}
